{
  "id": "ollama-models",
  "app": "Ollama",
  "category": "ai-models",
  "title": {
    "en": "Ollama models",
    "zh": "Ollama 本地模型"
  },
  "explain": {
    "en": "Models downloaded in the Ollama app or with ollama pull. Models you built yourself with ollama create may be your only copy, so Hoardless only shows the size. Remove models one by one with Ollama's own command.",
    "zh": "在 Ollama 里下载的模型（App 里点的或用 ollama pull 拉的）。你自己用 ollama create 做的模型可能只有这一份，所以这里只显示大小。要删请用 Ollama 自带的命令逐个删除。"
  },
  "paths": [
    "~/.ollama/models"
  ],
  "env_overrides": [
    {
      "var": "OLLAMA_MODELS"
    }
  ],
  "app_settings": [
    {
      "file": "~/Library/Application Support/Ollama/db.sqlite",
      "format": "sqlite",
      "key": "settings.models"
    }
  ],
  "safety": "protected",
  "official_cleanup": {
    "command": "ollama rm <model>",
    "source": "https://docs.ollama.com/cli"
  },
  "status": "verified",
  "evidence": [
    {
      "type": "official_source_code",
      "url": "https://raw.githubusercontent.com/ollama/ollama/main/envconfig/config.go",
      "checked": "2026-10-08"
    },
    {
      "type": "official_source_code",
      "url": "https://raw.githubusercontent.com/ollama/ollama/main/manifest/paths.go",
      "checked": "2026-10-08"
    }
  ],
  "notes": "The macOS app's model-location setting lives in ~/Library/Application Support/Ollama/db.sqlite (settings.models) and overrides OLLAMA_MODELS (app/server/server.go); read via app_settings (settings table, models column; app/store/database.go). Never target ~/.ollama as a whole: it holds id_ed25519 (auth key). Not installed on the maintainer's Mac, so no local observation."
}
