{
  "id": "capcut-generated-cache",
  "app": "CapCut",
  "category": "video-editors",
  "title": {
    "en": "CapCut rebuildable cache",
    "zh": "CapCut 可重建的缓存"
  },
  "explain": {
    "en": "Thumbnails, audio waveforms, frame images and speech-recognition results CapCut made for your drafts. When you open a draft again, CapCut remakes the thumbnails and waveforms by itself, and captions you already made stay in the draft. Running auto captions again on the same clip has to recognize the speech again. Also previews rendered for playback, web-panel files, font previews and other temporary files, which CapCut makes or downloads again when needed.",
    "zh": "CapCut 为你的草稿生成的缩略图、音频波形、画面图片和语音识别结果。再打开草稿时，缩略图和波形 CapCut 会自己重新生成；已经做好的字幕保存在草稿里，不受影响。以后对同一段素材再做自动字幕，需要重新识别一遍。还包括播放用的预渲染、界面网页文件、字体预览图等临时文件，CapCut 需要时会自己重新生成或下载。"
  },
  "paths": [
    "~/Movies/CapCut/User Data/Cache/recognize",
    "~/Movies/CapCut/User Data/Cache/image",
    "~/Movies/CapCut/User Data/Cache/frameThumbnail",
    "~/Movies/CapCut/User Data/Cache/audioWave",
    "~/Movies/CapCut/User Data/Cache/prerender",
    "~/Movies/CapCut/User Data/Cache/MotionBlurCache",
    "~/Movies/CapCut/User Data/Cache/VENetworkPlayer",
    "~/Movies/CapCut/User Data/Cache/importcache3",
    "~/Movies/CapCut/User Data/Cache/GeckoCpp",
    "~/Movies/CapCut/User Data/Cache/vepso",
    "~/Movies/CapCut/User Data/Cache/fontImage",
    "~/Movies/CapCut/User Data/Cache/DynamicDownloader"
  ],
  "safety": "review",
  "status": "verified",
  "evidence": [
    {
      "type": "local_observation",
      "note": "CapCut 9.5.0 on the maintainer's Mac, macOS 26.6.2: with CapCut quit, moved recognize, image, frameThumbnail and audioWave (1.63 GB together) out of User Data/Cache, then opened a draft with 30 text clips. Captions were intact; thumbnails and waveforms were remade (about 29 MB written); recognize stayed empty. Folders were put back afterwards and matched the snapshot taken before (48,923 entries).",
      "checked": "2026-10-09"
    },
    {
      "type": "local_observation",
      "note": "Second test, same day and version: moved prerender, MotionBlurCache, VENetworkPlayer, importcache3, GeckoCpp, vepso, fontImage and DynamicDownloader (166 MB) aside, then opened CapCut and the same draft. Home page, draft, playback, the Text panel and its template list worked; CapCut downloaded or remade GeckoCpp, fontImage, importcache3 and DynamicDownloader (59 MB), the rest when needed. Folders were put back and matched the snapshot (6,688 entries).",
      "checked": "2026-10-09"
    }
  ],
  "notes": "Tested with one draft each time. CapCut's globalSetting has no cache-location key, so a moved cache is not followed."
}
